{
  "competition_id": "cmp_demo_university_innovations",
  "title": "University Innovation Showcase (fictional example)",
  "status": "draft",
  "rules_version": "v1-draft",
  "deadline": "2028-03-31T15:00:00Z",
  "timezone": "Africa/Harare",
  "eligibility_summary": "Fictional sample: open to approved student projects with organizer confirmation.",
  "rubric": [
    {
      "criterion_id": "problem",
      "label": "Problem significance and clarity",
      "weight": 0.2
    },
    {
      "criterion_id": "technology",
      "label": "Demonstrated technical progress",
      "weight": 0.35
    },
    {
      "criterion_id": "evidence",
      "label": "Quality and relevance of evidence",
      "weight": 0.25
    },
    {
      "criterion_id": "execution",
      "label": "Feasibility and next-step plan",
      "weight": 0.2
    }
  ],
  "prize_terms": "No prize is promised; fictional demonstration of event rules.",
  "host_claim_status": "unverified",
  "terms_url": null
}
